"District","Representative","Party","Party","Prior experience","Education","Assumed office","Born in"
"Iowa 1","Blum, RodRod Blum",NA,"Republican","Businessman","Loras CollegeUniversity of Dubuque","2015",1955
"Iowa 2","Loebsack, DaveDave Loebsack",NA,"Democratic","Professor","Iowa State University","2007",1952
"Iowa 3","Young, DavidDavid Young",NA,"Republican","Congressional aide","Drake University","2015",1968
"Iowa 4","King, SteveSteve King",NA,"Republican","Iowa Senate","Northwest Missouri State University","2003",1949
"Kansas 1","Marshall, RogerRoger Marshall",NA,"Republican","Obstetrician","University of KansasKansas State University","2017",1960
"Kansas 2","Jenkins, LynnLynn Jenkins",NA,"Republican","Kansas State Treasurer, Kansas Senate, Kansas House of Representatives","Kansas State UniversityWeber State College","2009",1963
"Kansas 3","Yoder, KevinKevin Yoder",NA,"Republican","Kansas House of Representatives","University of KansasUniversity of Kansas Law School","2011",1976
"Kansas 4","Estes, RonRon Estes",NA,"Republican","Kansas State Treasurer","Tennessee Technological University","2017*",1956
"Kentucky 1","Comer, JamesJames Comer",NA,"Republican","Kentucky House of Representatives, Agriculture Commissioner of Kentucky","Western Kentucky University","2016*",1972
"Kentucky 2","Guthrie, BrettBrett Guthrie",NA,"Republican","Kentucky Senate","United States Military AcademyYale University","2009",1964
"Kentucky 3","Yarmuth, JohnJohn Yarmuth",NA,"Democratic","Newspaper Publisher, Vice-President for University Relations University of Louisville","Yale University","2007",1947
"Kentucky 4","Massie, ThomasThomas Massie",NA,"Republican","Judge-Executive of Lewis County, Kentucky","Massachusetts Institute of Technology","2012*",1971
"Kentucky 5","Rogers, HalHal Rogers",NA,"Republican","Commonwealth's Attorney for Pulaski and Rockcastle County, Kentucky","University of Kentucky","1981",1937
"Kentucky 6","Barr, AndyAndy Barr",NA,"Republican","Attorney","University of VirginiaUniversity of Kentucky College of Law","2013",1973
"Louisiana 1","Scalise, SteveSteve Scalise",NA,"Republican","Current House Majority WhipLouisiana State Senate, Louisiana House of Representatives","Louisiana State University","2008",1965
"Louisiana 2","Richmond, CedricCedric Richmond",NA,"Democratic","Louisiana House of Representatives","Morehouse CollegeTulane School of Law","2011",1973
"Louisiana 3","Higgins, ClayClay Higgins",NA,"Republican","Reserve Deputy Marshal of Lafayette, Louisiana","None","2017",1961
"Louisiana 4","Johnson, MikeMike Johnson",NA,"Republican","Louisiana House of Representatives","Louisiana State University","2017",1972
"Louisiana 5","Abraham, RalphRalph Abraham",NA,"Republican","Physician","Louisiana State UniversityLouisiana State University School of Medicine","2015",1954
"Louisiana 6","Graves, GarretGarret Graves",NA,"Republican","Louisiana Coastal Protection and Restoration Authority","","2015",1972
"Maine 1","Pingree, ChellieChellie Pingree",NA,"Democratic","Majority Leader Maine State Senate, President Common Cause","College of the Atlantic","2009",1955
"Maine 2","Poliquin, BruceBruce Poliquin",NA,"Republican","Maine State Treasurer","Harvard University","2015",1953
"Maryland 1","Harris, AndyAndy Harris",NA,"Republican","Maryland State Senate, Anesthesiologist","Johns Hopkins University","2011",1957
"Maryland 2","Ruppersberger, DutchDutch Ruppersberger",NA,"Democratic","Baltimore County Executive; Chief of the Office of Investigative Division for Maryland's Department of Justice; Baltimore County Assistant State's Attorney","University of MarylandUniversity of Baltimore","2003",1946
"Maryland 3","Sarbanes, JohnJohn Sarbanes",NA,"Democratic","Attorney, Law Clerk","Princeton UniversityHarvard Law School","2007",1962
"Maryland 4","Brown, Anthony G.Anthony G. Brown",NA,"Democratic","Lieutenant Governor of Maryland, Maryland House of Delegates","Harvard University","2017",1961
"Maryland 5","Hoyer, StenySteny Hoyer",NA,"Democratic","Current House Minority Whip
President of the Maryland State Senate, Maryland Board of Higher Education","University of MarylandGeorgetown University","1981*",1939
"Maryland 6","Delaney, JohnJohn Delaney",NA,"Democratic","Businessman","Columbia UniversityGeorgetown University Law Center","2013",1963
"Maryland 7","Cummings, ElijahElijah Cummings",NA,"Democratic","Speaker pro tempore of the Maryland House of Delegates","Howard UniversityUniversity of Maryland","1996*",1951
"Maryland 8","Raskin, JamieJamie Raskin",NA,"Democratic","Maryland State Senate Majority Whip","Harvard UniversityHarvard Law School","2017",1962
"Massachusetts 1","Neal, RichardRichard Neal",NA,"Democratic","Mayor of Springfield","American International CollegeUniversity of Hartford","1989",1949
"Massachusetts 2","McGovern, JimJim McGovern",NA,"Democratic","Congressional staff member","American University","1997",1959
"Massachusetts 3","Tsongas, NikiNiki Tsongas",NA,"Democratic","Dean of External Affairs at Middlesex Community College","Smith CollegeBoston University","2007*",1946
"Massachusetts 4","Kennedy, JoeJoe Kennedy",NA,"Democratic","Prosecutor, assistant district attorney","Stanford UniversityHarvard University","2013",1980
"Massachusetts 5","Clark, KatherineKatherine Clark",NA,"Democratic","Massachusetts Senate, Massachusetts House of Representatives, Attorney","St. Lawrence UniversityCornell UniversityHarvard University","2013*",1963
"Massachusetts 6","Moulton, SethSeth Moulton",NA,"Democratic","Businessman, Activist, U.S. Marine Corps Captain","Harvard University","2015",1978
"Massachusetts 7","Capuano, MikeMike Capuano",NA,"Democratic","Mayor of Somerville","Dartmouth CollegeBoston College Law School","1999",1952
"Massachusetts 8","Lynch, Stephen F.Stephen F. Lynch",NA,"Democratic","Massachusetts Senate, Massachusetts House of Representatives","Wentworth Institute of TechnologyBoston College Law School","2001*",1955
"Massachusetts 9","Keating, BillBill Keating",NA,"Democratic","Massachusetts House of Representatives, Massachusetts Senate, Norfolk County District Attorney","Boston CollegeSuffolk University Law School","2011",1952
"Michigan 1","Bergman, JackJack Bergman",NA,"Republican","U.S. Marine Corps Lieutenant General","Gustavus Adolphus CollegeUniversity of West FloridaCommand and General Staff CollegeSyracuse University","2017",1947
"Michigan 2","Huizenga, BillBill Huizenga",NA,"Republican","Michigan House of Representatives","Calvin College","2011",1969
"Michigan 3","Amash, JustinJustin Amash",NA,"Republican","Michigan House of Representatives","University of MichiganUniversity of Michigan Law School","2011",1980
"Michigan 4","Moolenaar, JohnJohn Moolenaar",NA,"Republican","Michigan Senate, Michigan House of Representatives","Hope CollegeHarvard University","2015",1961
"Michigan 5","Kildee, DanDan Kildee",NA,"Democratic","Genessee County Treasurer","Central Michigan University","2013",1958
"Michigan 6","Upton, FredFred Upton",NA,"Republican","U.S. government administrator","University of Michigan","1987",1953
"Michigan 7","Walberg, TimTim Walberg",NA,"Republican","U.S. House, Michigan House of Representatives","Taylor UniversityWheaton College","2011",1951
"Michigan 8","Bishop, MikeMike Bishop",NA,"Republican","Michigan Senate Majority Leader, Michigan House of Representatives","University of MichiganDetroit College of Law","2015",1967
"Michigan 9","Levin, SanderSander Levin",NA,"Democratic","Michigan Senate, U.S. Government administrator","University of ChicagoColumbia UniversityHarvard Law School","1983",1931
"Michigan 10","Mitchell, PaulPaul Mitchell",NA,"Republican","Businessman","Michigan State University","2017",1961
"Michigan 11","Trott, DavidDavid Trott",NA,"Republican","Lawyer","University of MichiganDuke University School of Law","2015",1960
"Michigan 12","Dingell, DebbieDebbie Dingell",NA,"Democratic","Lobbyist, Wife of John Dingell","Georgetown University","2015",1953
"Michigan 13","Conyers, JohnJohn Conyers",NA,"Democratic","Congressional aide","Wayne State University","1965",1929
"Michigan 14","Lawrence, BrendaBrenda Lawrence",NA,"Democratic","Mayor of Southfield","Central Michigan University","2015",1954
"Minnesota 1","Walz, TimTim Walz",NA,"Democratic","Army National Guard Command Sergeant Major, teacher","Chadron State College","2007",1964
"Minnesota 2","Lewis, JasonJason Lewis",NA,"Republican","Radio show host","University of Colorado at DenverUniversity of Northern Iowa","2017",1955
"Minnesota 3","Paulsen, ErikErik Paulsen",NA,"Republican","Majority Leader of the Minnesota House of Representatives","St. Olaf College","2009",1965
"Minnesota 4","McCollum, BettyBetty McCollum",NA,"Democratic","North St. Paul City Council, Minnesota House of Representatives","College of St. Catherine","2001",1954
"Minnesota 5","Ellison, KeithKeith Ellison",NA,"Democratic","Minnesota House of Representatives","Wayne State UniversityUniversity of Minnesota Law School","2007",1963
"Minnesota 6","Emmer, TomTom Emmer",NA,"Republican","Minnesota House of Representatives","University of Alaska FairbanksWilliam Mitchell College of Law","2015",1961
"Minnesota 7","Peterson, CollinCollin Peterson",NA,"Democratic","Certified Public Accountant, Minnesota Senate","Moorhead State University","1991",1944
"Minnesota 8","Nolan, RickRick Nolan",NA,"Democratic","Minnesota House of Representatives, U.S. House, businessman","St. John's UniversityUniversity of MinnesotaUniversity of MarylandSt. Cloud State University","2013",1943
"Mississippi 1","Kelly, TrentTrent Kelly",NA,"Republican","District attorney, Tupelo, city prosecutor, Army National Guard Colonel","University of MississippiU.S. Army War College","2015*",1966
"Mississippi 2","Thompson, BennieBennie Thompson",NA,"Democratic","alderman, mayor of Bolton, Hinds County Board of Supervisors","Tougaloo CollegeJackson State University","1993*",1948
"Mississippi 3","Harper, GreggGregg Harper",NA,"Republican","Attorney, Rankin County Party Chairman","Mississippi CollegeUniversity of Mississippi","2009",1956
"Mississippi 4","Palazzo, StevenSteven Palazzo",NA,"Republican","Mississippi House of Representatives","University of Southern Mississippi","2011",1970
"Missouri 1","Clay, WilliamWilliam Clay",NA,"Democratic","Missouri Senate, Missouri House of Representatives","University of MarylandHarvard University","2001",1956
"Missouri 2","Wagner, AnnAnn Wagner",NA,"Republican","U.S. Ambassador to Luxembourg","University of Missouri","2013",1962
"Missouri 3","Luetkemeyer, BlaineBlaine Luetkemeyer",NA,"Republican","Missouri House of Representatives, State Tourism Director","Lincoln University","2009",1952
"Missouri 4","Hartzler, VickyVicky Hartzler",NA,"Republican","Missouri House of Representatives","University of MissouriCentral Missouri State University","2011",1960
"Missouri 5","Cleaver, EmanuelEmanuel Cleaver",NA,"Democratic","Mayor of Kansas City, pastor, radio show host","Prairie View A&M UniversitySt. Paul School of Theology","2005",1944
"Missouri 6","Graves, SamSam Graves",NA,"Republican","Missouri Senate","University of Missouri","2001",1963
"Missouri 7","Long, BillyBilly Long",NA,"Republican","auctioneer","National Auctioneers Association Education Institute","2011",1955
"Missouri 8","Smith, Jason T.Jason T. Smith",NA,"Republican","Missouri House of Representatives","University of Missouri","2013*",1980
"Montana At Large","Gianforte, GregGreg Gianforte",NA,"Republican","business owner","Stevens Institute of Technology","2017*",1961
"Nebraska 1","Fortenberry, JeffJeff Fortenberry",NA,"Republican","Lincoln city council, businessman","Louisiana State UniversityGeorgetown UniversityFranciscan University of Steubenville","2005",1960
"Nebraska 2","Bacon, DonDon Bacon",NA,"Republican","U.S. Air Force Brigadier General","Northern Illinois University","2017",1963
"Nebraska 3","Smith, AdrianAdrian Smith",NA,"Republican","Gering City Council, Nebraska Legislature","University of Nebraska","2007",1970
"Nevada 1","Titus, DinaDina Titus",NA,"Democratic","U.S. House, Nevada Senate","College of William & MaryUniversity of GeorgiaFlorida State University","2013",1950
"Nevada 2","Amodei, MarkMark Amodei",NA,"Republican","Nevada Senate, Nevada Assembly","University of Nevada, RenoUniversity of the Pacific","2011*",1958
"Nevada 3","Rosen, JackyJacky Rosen",NA,"Democratic","software developer","University of Minnesota","2017",1957
"Nevada 4","Kihuen, RubenRuben Kihuen",NA,"Democratic","Nevada Assembly, Nevada Senate","University of Nevada, Las Vegas","2017",1980
"New Hampshire 1","Shea-Porter, CarolCarol Shea-Porter",NA,"Democratic","U.S. House","University of New Hampshire","2017",1952
"New Hampshire 2","McLane Kuster, AnnAnn McLane Kuster",NA,"Democratic","Attorney, lobbyist","Dartmouth CollegeGeorgetown University Law Center","2013",1956
"New Jersey 1","Norcross, DonaldDonald Norcross",NA,"Democratic","New Jersey Senate, New Jersey General Assembly","Camden County College","2014*",1958
"New Jersey 2","LoBiondo, FrankFrank LoBiondo",NA,"Republican","New Jersey General Assembly","St. Joseph's University","1995",1946
"New Jersey 3","MacArthur, TomTom MacArthur",NA,"Republican","Mayor of Randolph","Hofstra University","2015",1960
"New Jersey 4","Smith, ChrisChris Smith",NA,"Republican","Retail executive","Trenton State College","1981",1953
"New Jersey 5","Gottheimer, JoshJosh Gottheimer",NA,"Democratic","Lawyer, political aide","University of PennsylvaniaHarvard Law School","2017",1975
"New Jersey 6","Pallone, FrankFrank Pallone",NA,"Democratic","Long Branch city council, New Jersey Senate","Middlebury CollegeTufts UniversityRutgers University","1988*",1951
"New Jersey 7","Lance, LeonardLeonard Lance",NA,"Republican","New Jersey Senate, New Jersey General Assembly","Lehigh UniversityVanderbilt UniversityPrinceton University","2009",1952
"New Jersey 8","Sires, AlbioAlbio Sires",NA,"Democratic","Mayor of West New York, Speaker of the New Jersey General Assembly","Saint Peter's CollegeMiddlebury College","2006*",1951
"New Jersey 9","Pascrell, BillBill Pascrell",NA,"Democratic","New Jersey General Assembly, Mayor of Paterson","Fordham University","1997",1937
"New Jersey 10","Payne, Jr., DonaldDonald Payne, Jr.",NA,"Democratic","Newark Municipal Council, Essex County Freeholder","Kean University","2012*",1958
"New Jersey 11","Frelinghuysen, RodneyRodney Frelinghuysen",NA,"Republican","New Jersey General Assembly","Hobart College","1995",1946
"New Jersey 12","Watson Coleman, BonnieBonnie Watson Coleman",NA,"Democratic","New Jersey General Assembly Majority Leader","Thomas Edison State College","2015",1945
"New Mexico 1","Lujan Grisham, MichelleMichelle Lujan Grisham",NA,"Democratic","Bernalillo County Commissioner, New Mexico Secretary of Health, Director of New Mexico Agency on Aging","University of New MexicoUniversity of New Mexico School of Law","2013",1959
"New Mexico 2","Pearce, SteveSteve Pearce",NA,"Republican","U.S. House, New Mexico House of Representatives","New Mexico State UniversityEastern New Mexico University","2011",1947
"New Mexico 3","Luján, BenBen Luján",NA,"Democratic","New Mexico Public Regulation Commissioner","New Mexico Highlands University","2009",1972
"New York 1","Zeldin, LeeLee Zeldin",NA,"Republican","New York Senate","University at Albany, SUNYAlbany Law School","2015",1980
"New York 2","King, PeterPeter King",NA,"Republican","Hempstead Town Council, Nassau County Comptroller","St. Francis CollegeUniversity of Notre Dame","1993",1944
"New York 3","Suozzi, ThomasThomas Suozzi",NA,"Democratic","County Executive of Nassau County, Mayor of Glen Cove, New York","Boston CollegeFordham University School of Law","2017",1962
"New York 4","Rice, KathleenKathleen Rice",NA,"Democratic","Nassau County District Attorney","Catholic UniversityTouro Law Center","2015",1965
"New York 5","Meeks, GregoryGregory Meeks",NA,"Democratic","New York State Assembly","Adelphi UniversityHoward University","1998*",1953
"New York 6","Meng, GraceGrace Meng",NA,"Democratic","New York State Assembly","University of MichiganBenjamin N. Cardozo School of Law","2013",1975
"New York 7","Velázquez, NydiaNydia Velázquez",NA,"Democratic","Director, Dept. of Puerto Rican Community Affairs","University of Puerto RicoNew York University","1993",1953
"New York 8","Jeffries, HakeemHakeem Jeffries",NA,"Democratic","New York State Assembly","New York University School of LawGeorgetown UniversityBinghamton University","2013",1970
"New York 9","Clarke, YvetteYvette Clarke",NA,"Democratic","New York City Council","Oberlin College","2007",1964
"New York 10","Nadler, JerroldJerrold Nadler",NA,"Democratic","New York State Assembly","Columbia UniversityFordham University","1992*",1947
"New York 11","Donovan, DanielDaniel Donovan",NA,"Republican","Richmond County District Attorney","St. John's UniversityFordham University","2015*",1956
"New York 12","Maloney, CarolynCarolyn Maloney",NA,"Democratic","New York City Council","Greensboro College","1993",1946
"New York 13","Espaillat, AdrianoAdriano Espaillat",NA,"Democratic","New York State Senate, New York State Assembly","Queens College","2017",1954
"New York 14","Crowley, JosephJoseph Crowley",NA,"Democratic","New York State Assembly","Queens College","1999",1962
"New York 15","Serrano, JoséJosé Serrano",NA,"Democratic","New York State Assembly","Lehman College","1990*",1943
"New York 16","Engel, EliotEliot Engel",NA,"Democratic","high school teacher, New York State Assembly","Lehman CollegeNew York Law School","1989",1947
"New York 17","Lowey, NitaNita Lowey",NA,"Democratic","New York Assistant Secretary of State","Mount Holyoke College","1989",1937
"New York 18","Maloney, Sean PatrickSean Patrick Maloney",NA,"Democratic","Attorney","University of Virginia","2013",1966
"New York 19","Faso, JohnJohn Faso",NA,"Republican","New York State Assembly","State University of New York at BrockportGeorgetown University","2017",1952
"New York 20","Tonko, PaulPaul Tonko",NA,"Democratic","New York State Assembly","Clarkson University","2009",1949
"New York 21","Stefanik, EliseElise Stefanik",NA,"Republican","Civil servant, Political activist","Harvard University","2015",1984
"New York 22","Tenney, ClaudiaClaudia Tenney",NA,"Republican","New York State Assembly","Colgate UniversityUniversity of Cincinnati College of Law","2017",1961
"New York 23","Reed, TomTom Reed",NA,"Republican","Mayor of Corning","Alfred UniversityOhio Northern University, Pettit College of Law","2010*",1971
"New York 24","Katko, JohnJohn Katko",NA,"Republican","Attorney, Prosecutor U.S. Attorney's Office","Niagara UniversitySyracuse University College of Law","2015",1962
"New York 25","Slaughter, LouiseLouise Slaughter",NA,"Democratic","Monroe County Legislature, New York State Assembly","University of Kentucky","1987",1929
"New York 26","Higgins, BrianBrian Higgins",NA,"Democratic","Buffalo Common Council, New York State Assembly","University at BuffaloHarvard University","2005",1959
"New York 27","Collins, ChrisChris Collins",NA,"Republican","Erie County Executive","North Carolina State UniversityUniversity of Alabama at Birmingham","2013",1950
"North Carolina 1","Butterfield, G. K.G. K. Butterfield",NA,"Democratic","North Carolina Supreme Court Justice","North Carolina Central University","2004*",1947
"North Carolina 2","Holding, GeorgeGeorge Holding",NA,"Republican","U.S. Attorney for Eastern North Carolina","Wake Forest UniversityWake Forest University School of Law","2013",1968
"North Carolina 3","Jones, WalterWalter Jones",NA,"Republican","North Carolina House of Representatives","Atlantic Christian College","1995",1943
"North Carolina 4","Price, DavidDavid Price",NA,"Democratic","college professor","Mars Hill CollegeUniversity of North Carolina at Chapel HillYale University","1997",1940
"North Carolina 5","Foxx, VirginiaVirginia Foxx",NA,"Republican","North Carolina Senate","University of North Carolina at Chapel HillUniversity of North Carolina at Greensboro","2005",1943
"North Carolina 6","Walker, MarkMark Walker",NA,"Republican","Southern Baptist pastor","Piedmont International University","2015",1969
"North Carolina 7","Rouzer, DavidDavid Rouzer",NA,"Republican","North Carolina Senate","North Carolina State University","2015",1972
"North Carolina 8","Hudson, RichardRichard Hudson",NA,"Republican","Businessman","University of North Carolina at Charlotte","2013",1971
"North Carolina 9","Pittenger, RobertRobert Pittenger",NA,"Republican","North Carolina Senate","University of Texas","2013",1948
"North Carolina 10","McHenry, PatrickPatrick McHenry",NA,"Republican","North Carolina House of Representatives","North Carolina State UniversityBelmont Abbey College","2005",1975
"North Carolina 11","Meadows, MarkMark Meadows",NA,"Republican","Businessman","University of South Florida","2013",1959
"North Carolina 12","Adams, AlmaAlma Adams",NA,"Democratic","North Carolina House of Representatives","North Carolina A&T State UniversityOhio State University","2014*",1946
"North Carolina 13","Budd, TedTed Budd",NA,"Republican","Businessman","Wake Forest UniversityAppalachian State University","2017",1971
"North Dakota At Large","Cramer, KevinKevin Cramer",NA,"Republican","North Dakota Public Service Commissioner","Concordia CollegeUniversity of Mary","2013",1961
"Ohio 1","Chabot, SteveSteve Chabot",NA,"Republican","Cincinnati City Council, Hamilton County Commissioner, U.S. House","College of William & MaryNorthern Kentucky University","2011",1953
"Ohio 2","Wenstrup, BradBrad Wenstrup",NA,"Republican","Physician","University of Cincinnati","2013",1958
"Ohio 3","Beatty, JoyceJoyce Beatty",NA,"Democratic","Ohio House of Representatives","Central State UniversityWright State UniversityUniversity of Cincinnati","2013",1950
"Ohio 4","Jordan, JimJim Jordan",NA,"Republican","Ohio Senate, Ohio House of Representatives","University of Wisconsin–Madison","2007",1964
"Ohio 5","Latta, BobBob Latta",NA,"Republican","Wood County Commissioner, Ohio House of Representatives, Ohio Senate","Bowling Green State UniversityUniversity of Toledo","2007",1956
"Ohio 6","Johnson, BillBill Johnson",NA,"Republican","United States Air Force","Troy University","2011",1954
"Ohio 7","Gibbs, BobBob Gibbs",NA,"Republican","Ohio Senate, Ohio House of Representatives","Ohio State University Agricultural Technical Institute","2011",1954
"Ohio 8","Davidson, WarrenWarren Davidson",NA,"Republican","Businessman","United States Military AcademyUniversity of Notre Dame","2016*",1970
"Ohio 9","Kaptur, MarcyMarcy Kaptur",NA,"Democratic","Domestic Policy Advisor, Carter Adm.","University of WisconsinUniversity of MichiganMassachusetts Institute of Technology","1983",1946
"Ohio 10","Turner, MikeMike Turner",NA,"Republican","Mayor of Dayton","Ohio Northern UniversityCase Western Reserve UniversityUniversity of Dayton","2003",1960
"Ohio 11","Fudge, MarciaMarcia Fudge",NA,"Democratic","Mayor of Warrensville Heights","Ohio State UniversityCleveland-Marshall College of Law","2008*",1952
"Ohio 12","Tiberi, PatPat Tiberi",NA,"Republican","Ohio House of Representatives","Ohio State UniversityCapital University","2001",1962
"Ohio 13","Ryan, TimTim Ryan",NA,"Democratic","Ohio Senate","Bowling Green State UniversityUniversity of New Hampshire School of Law","2003",1973
"Ohio 14","Joyce, DavidDavid Joyce",NA,"Republican","Geauga County Prosecutor","University of Dayton","2013",1957
"Ohio 15","Stivers, SteveSteve Stivers",NA,"Republican","Ohio Senate","Ohio State University","2011",1965
"Ohio 16","Renacci, JimJim Renacci",NA,"Republican","businessman, Mayor of Wadsworth","Indiana University of Pennsylvania","2011",1958
"Oklahoma 1","Bridenstine, JimJim Bridenstine",NA,"Republican","Museum director","Rice UniversitySamuel Curtis Johnson Graduate School of Management","2013",1975
"Oklahoma 2","Mullin, MarkwayneMarkwayne Mullin",NA,"Republican","Businessman","Missouri Valley College","2013",1977
"Oklahoma 3","Lucas, FrankFrank Lucas",NA,"Republican","Oklahoma House of Representatives","Oklahoma State University","1994*",1960
"Oklahoma 4","Cole, TomTom Cole",NA,"Republican","Oklahoma Senate, Oklahoma Secretary of State, college professor","Grinnell CollegeYale UniversityUniversity of Oklahoma","2003",1949
"Oklahoma 5","Russell, SteveSteve Russell",NA,"Republican","Oklahoma Senate, U. S. Army Lieutenant Colonel","Ouachita Baptist University","2015",1963
"Oregon 1","Bonamici, SuzanneSuzanne Bonamici",NA,"Democratic","Oregon House of Representatives, Oregon State Senate","Lane Community CollegeUniversity of Oregon","2012*",1954
"Oregon 2","Walden, GregGreg Walden",NA,"Republican","Oregon House of Representatives, Oregon State Senate","University of Oregon","1999",1957
"Oregon 3","Blumenauer, EarlEarl Blumenauer",NA,"Democratic","Oregon House of Representatives, Multnomah County Commissioner, Portland City Commissioner","Lewis & Clark College","1996*",1948
"Oregon 4","DeFazio, PeterPeter DeFazio",NA,"Democratic","Lane County Commissioner","Tufts UniversityUniversity of OregonUniversity of Notre Dame","1987",1947
"Oregon 5","Schrader, KurtKurt Schrader",NA,"Democratic","Veterinarian, Oregon State Senate","Cornell UniversityUniversity of Illinois","2009",1951
"Pennsylvania 1","Brady, BobBob Brady",NA,"Democratic","Congressional aide; Pennsylvania Turnpike Commission","St. Thomas More High School","1998*",1945
"Pennsylvania 2","Evans, DwightDwight Evans",NA,"Democratic","Pennsylvania House of Representatives","La Salle University","2016*",1954
"Pennsylvania 3","Kelly, MikeMike Kelly",NA,"Republican","businessman","University of Notre Dame","2011",1948
"Pennsylvania 4","Perry, ScottScott Perry",NA,"Republican","Pennsylvania House of Representatives","Pennsylvania State University","2013",1962
