"District","Representative","Party","Party","Prior experience","Education","Assumed office","Born in"
"Alabama 1","Byrne, BradleyBradley Byrne",NA,"Republican","Alabama Senate, Alabama State Board of Education","Duke UniversityUniversity of Alabama","2013*",1955
"Alabama 2","Roby, MarthaMartha Roby",NA,"Republican","Montgomery City Council","New York UniversityCumberland School of Law","2011",1976
"Alabama 3","Rogers, MikeMike Rogers",NA,"Republican","Calhoun County Commissioner, Alabama House of Representatives","Jacksonville State UniversityBirmingham School of Law","2003",1958
"Alabama 4","Aderholt, RobertRobert Aderholt",NA,"Republican","Haleyville Municipal Judge","Birmingham–Southern CollegeSamford University","1997",1965
"Alabama 5","Brooks, MoMo Brooks",NA,"Republican","Alabama House of Representatives, Madison County Commissioner","Duke UniversityUniversity of Alabama","2011",1954
"Alabama 6","Palmer, GaryGary Palmer",NA,"Republican","Policy analyst","University of Alabama","2015",1954
"Alabama 7","Sewell, TerriTerri Sewell",NA,"Democratic","Attorney","Princeton UniversityHarvard Law SchoolUniversity of Oxford","2011",1965
"Alaska At Large","Young, DonDon Young",NA,"Republican","Alaska Senate, Ship captain, Mayor of Fort Yukon, Alaska","California State University, Chico","1973*",1933
"Arizona 1","O'Halleran, TomTom O'Halleran",NA,"Democratic","Arizona Senate","None","2017",1946
"Arizona 2","McSally, MarthaMartha McSally",NA,"Republican","USAF Colonel","United States Air Force Academy","2015",1966
"Arizona 3","Grijalva, RaúlRaúl Grijalva",NA,"Democratic","Pima County Board of Supervisors","University of Arizona","2003",1948
"Arizona 4","Gosar, PaulPaul Gosar",NA,"Republican","President of the Northern Arizona Dental Society","Creighton UniversityCreighton University School of Dentistry","2011",1958
"Arizona 5","Biggs, AndyAndy Biggs",NA,"Republican","Arizona Senate","Arizona State UniversityBrigham Young University, University of Arizona","2017",1958
"Arizona 6","Schweikert, DavidDavid Schweikert",NA,"Republican","Arizona House of Representatives, Arizona Board of Education, Arizona Board of Equalization, Maricopa County Treasurer","Arizona State University","2011",1962
"Arizona 7","Gallego, RubenRuben Gallego",NA,"Democratic","Arizona House of Representatives","Harvard University","2015",1979
"Arizona 8","Franks, TrentTrent Franks",NA,"Republican","Arizona House of Representatives","Ottawa University","2003",1957
"Arizona 9","Sinema, KyrstenKyrsten Sinema",NA,"Democratic","Arizona Senate, Arizona House of Representatives","Brigham Young UniversityArizona State University","2013",1976
"Arkansas 1","Crawford, RickRick Crawford",NA,"Republican","Broadcaster, Businessman","Arkansas State University","2011",1966
"Arkansas 2","Hill, FrenchFrench Hill",NA,"Republican","Businessman","Vanderbilt UniversityUCLA Anderson School of Management","2015",1956
"Arkansas 3","Womack, SteveSteve Womack",NA,"Republican","Mayor of Rogers, Arkansas","Arkansas Tech University","2011",1957
"Arkansas 4","Westerman, BruceBruce Westerman",NA,"Republican","Arkansas House of Representatives","University of ArkansasYale University","2015",1967
"California 1","LaMalfa, DougDoug LaMalfa",NA,"Republican","California State Senate, California State Assembly","California Polytechnic State University","2013",1960
"California 2","Huffman, JaredJared Huffman",NA,"Democratic","California State Assembly","University of California, Santa BarbaraBoston College Law School","2013",1964
"California 3","Garamendi, JohnJohn Garamendi",NA,"Democratic","Lieutenant Governor of California, United States Deputy Secretary of the Interior, California Insurance Commissioner, California State Senate, California State Assembly","University of California, BerkeleyHarvard Business School","2009*",1945
"California 4","McClintock, TomTom McClintock",NA,"Republican","California Senate, California State Assembly","University of California, Los Angeles","2009",1956
"California 5","Thompson, MikeMike Thompson",NA,"Democratic","California State Senate","California State University, Chico","1999",1951
"California 6","Matsui, DorisDoris Matsui",NA,"Democratic","Sacramento, California City Council","University of California, Berkeley","2005*",1944
"California 7","Bera, AmiAmi Bera",NA,"Democratic","Chief Medical Officer of Sacramento County, California","University of California, Irvine","2013",1965
"California 8","Cook, PaulPaul Cook",NA,"Republican","California State Assembly","Southern Connecticut State UniversityCalifornia State University, San BernardinoUniversity of California, Riverside","2013",1943
"California 9","McNerney, JerryJerry McNerney",NA,"Democratic","Engineering executive","University of New Mexico","2007",1951
"California 10","Denham, JeffJeff Denham",NA,"Republican","California State Senate","California Polytechnic State University","2011",1967
"California 11","DeSaulnier, MarkMark DeSaulnier",NA,"Democratic","California State Senate, California State Assembly, Contra Costa County Board of Supervisors","College of the Holy Cross","2015",1952
"California 12","Pelosi, NancyNancy Pelosi",NA,"Democratic","Current House Minority Leader
Northern California Democratic Party Chairwoman","Trinity Washington University","1987*",1940
"California 13","Lee, BarbaraBarbara Lee",NA,"Democratic","California State Assembly","Mills CollegeUniversity of California, Berkeley","1998*",1946
"California 14","Speier, JackieJackie Speier",NA,"Democratic","California State Senate, California State Assembly, San Mateo County Board of Supervisors","University of California, DavisUC, Hastings Law","2008*",1950
"California 15","Swalwell, EricEric Swalwell",NA,"Democratic","Dublin City Council","University of Maryland, College ParkUniversity of Maryland School of Law","2013",1980
"California 16","Costa, JimJim Costa",NA,"Democratic","California State Senate, California State Assembly","California State University, Fresno","2005",1952
"California 17","Khanna, RoRo Khanna",NA,"Democratic","Lawyer, author, educator","University of Chicago, Yale Law School","2017",1976
"California 18","Eshoo, AnnaAnna Eshoo",NA,"Democratic","San Mateo County Board of Supervisors","Cañada CollegeMenlo College","1993",1942
"California 19","Lofgren, ZoeZoe Lofgren",NA,"Democratic","Santa Clara County Board of Supervisors","Stanford UniversitySanta Clara University","1995",1947
"California 20","Panetta, JimmyJimmy Panetta",NA,"Democratic","Deputy district attorney of Monterey County","Monterey Peninsula CollegeSanta Clara UniversityUniversity of California, Davis","2017",1969
"California 21","Valadao, DavidDavid Valadao",NA,"Republican","California State Assembly","College of the Sequoias","2013",1977
"California 22","Nunes, DevinDevin Nunes",NA,"Republican","California State Director for the United States Department of Agriculture's Rural Development Section","College of the SequoiasCal Poly University, San Luis Obispo","2003",1973
"California 23","McCarthy, KevinKevin McCarthy",NA,"Republican","Current House Majority LeaderCalifornia State Assembly","California State University, Bakersfield","2007",1965
"California 24","Carbajal, SaludSalud Carbajal",NA,"Democratic","Santa Barbara County, California Board of Supervisors","Fielding Graduate UniversityUniversity of California, Santa Barbara","2017",1964
"California 25","Knight, SteveSteve Knight",NA,"Republican","California State Senate, California State Assembly, Palmdale City Council","Antelope Valley College","2015",1966
"California 26","Brownley, JuliaJulia Brownley",NA,"Democratic","California State Assembly","George Washington UniversityAmerican University","2013",1952
"California 27","Chu, JudyJudy Chu",NA,"Democratic","Mayor of Monterey Park, Monterey Park City Council, California State Assembly, California State Board of Equalization","University of California, Los Angeles","2009*",1953
"California 28","Schiff, AdamAdam Schiff",NA,"Democratic","California State Senate, Assistant Prosecutor for the United States Attorney for the Southern District of California","Stanford UniversityHarvard University","2001",1960
"California 29","Cárdenas, TonyTony Cárdenas",NA,"Democratic","Los Angeles City Council","University of California, Santa Barbara","2013",1963
"California 30","Sherman, BradBrad Sherman",NA,"Democratic","California Board of Equalization","University of California, Los AngelesHarvard Law School","1997",1954
"California 31","Aguilar, PetePete Aguilar",NA,"Democratic","Mayor of Redlands","University of Redlands","2015",1979
"California 32","Napolitano, GraceGrace Napolitano",NA,"Democratic","California State Assembly","Texas Southmost College","1999",1936
"California 33","Lieu, TedTed Lieu",NA,"Democratic","California State Senate, California State Assembly","Stanford UniversityGeorgetown University","2015",1969
"California 34","Gomez, JimmyJimmy Gomez",NA,"Democratic","California State Assembly","UCLAHarvard University","2017*",1974
"California 35","Torres, NormaNorma Torres",NA,"Democratic","California State Senate, California State Assembly, Mayor of Pomona","National Labor College","2015",1965
"California 36","Ruiz, RaulRaul Ruiz",NA,"Democratic","Emergency physician","University of California, Los AngelesHarvard University","2013",1972
"California 37","Bass, KarenKaren Bass",NA,"Democratic","Speaker of the California State Assembly","California State University, Dominguez Hills","2011",1953
"California 38","Sánchez, LindaLinda Sánchez",NA,"Democratic","Attorney","University of California, BerkeleyUniversity of California, Los Angeles","2003",1969
"California 39","Royce, EdEd Royce",NA,"Republican","California State Senate","California State University, Fullerton","1993",1951
"California 40","Roybal-Allard, LucilleLucille Roybal-Allard",NA,"Democratic","public relations executive","California State University, Los Angeles","1993",1941
"California 41","Takano, MarkMark Takano",NA,"Democratic","Teacher","Harvard University","2013",1960
"California 42","Calvert, KenKen Calvert",NA,"Republican","Real Estate Executive","Chaffey CollegeSan Diego State University","1993",1953
"California 43","Waters, MaxineMaxine Waters",NA,"Democratic","California State Assembly","California State University, Los Angeles","1991",1938
"California 44","Barragán, NanetteNanette Barragán",NA,"Democratic","Hermosa Beach City Council","University of California, Los Angeles, University of Southern California","2017",1976
"California 45","Walters, MimiMimi Walters",NA,"Republican","California State Senate, California State Assembly, Mayor of Laguna Niguel","University of California, Los Angeles","2015",1962
"California 46","Correa, LouLou Correa",NA,"Democratic","California State Senate, Orange County Board of Supervisors, California State Assembly","University of California, Los AngelesCalifornia State University, Fullerton","2017",1958
"California 47","Lowenthal, AlanAlan Lowenthal",NA,"Democratic","California State Senate, California State Assembly","Ohio State University|Hobart College","2013",1941
"California 48","Rohrabacher, DanaDana Rohrabacher",NA,"Republican","Special assistant to President Reagan","California State University, Long BeachUniversity of Southern California","1989",1947
"California 49","Issa, DarrellDarrell Issa",NA,"Republican","Electronics executive","Kent State University","2001",1953
"California 50","Hunter, Duncan D.Duncan D. Hunter",NA,"Republican","Military officer, businessman","San Diego State University","2009",1976
"California 51","Vargas, JuanJuan Vargas",NA,"Democratic","California State Senate, California State Assembly, San Diego City Council","Harvard Law SchoolFordham UniversityUniversity of San Diego","2013",1961
"California 52","Peters, ScottScott Peters",NA,"Democratic","San Diego City Council, San Diego Port Commission","Duke UniversityNew York University School of Law","2013",1958
"California 53","Davis, SusanSusan Davis",NA,"Democratic","California State Assembly, San Diego School Board","University of California, BerkeleyUniversity of North Carolina at Chapel Hill","2001",1944
"Colorado 1","DeGette, DianaDiana DeGette",NA,"Democratic","Colorado House of Representatives","Colorado College","1997",1957
"Colorado 2","Polis, JaredJared Polis",NA,"Democratic","Colorado State Board of Education, Internet Executive","Princeton University","2009",1975
"Colorado 3","Tipton, ScottScott Tipton",NA,"Republican","Colorado House of Representatives","Fort Lewis College","2011",1956
"Colorado 4","Buck, KenKen Buck",NA,"Republican","Weld County District Attorney, Prosecutor U.S. Attorney's Office","Princeton University, University of Wyoming","2015",1959
"Colorado 5","Lamborn, DougDoug Lamborn",NA,"Republican","President pro tempore of the Colorado Senate, Colorado House of Representatives","University of Kansas","2007",1954
"Colorado 6","Coffman, MikeMike Coffman",NA,"Republican","Secretary of State of Colorado, Colorado State Treasurer, Colorado Senate, Colorado House of Representatives","University of Colorado","2009",1955
"Colorado 7","Perlmutter, EdEd Perlmutter",NA,"Democratic","Colorado Senate","University of Colorado","2007",1953
"Connecticut 1","Larson, John B.John B. Larson",NA,"Democratic","Connecticut Senate, East Hartford, Connecticut City Council, East Hartford, Connecticut Board of Education","Central Connecticut State University","1999",1948
"Connecticut 2","Courtney, JoeJoe Courtney",NA,"Democratic","Connecticut House of Representatives","Tufts University","2007",1953
"Connecticut 3","DeLauro, RosaRosa DeLauro",NA,"Democratic","Executive Director of EMILY's List, Political aide","Marymount College","1991",1943
"Connecticut 4","Himes, JimJim Himes",NA,"Democratic","Financial executive, Greenwich Housing Authority Board","Harvard UniversityUniversity of Oxford","2009",1966
"Connecticut 5","Esty, ElizabethElizabeth Esty",NA,"Democratic","Connecticut House of Representatives","Harvard UniversityYale University","2013",1959
"Delaware At Large","Blunt Rochester, LisaLisa Blunt Rochester",NA,"Democratic","Delaware Labor Secretary, Delaware Personnel Director","Fairleigh Dickinson UniversityUniversity of Delaware","2017",1962
"Florida 1","Gaetz, MattMatt Gaetz",NA,"Republican","Florida House of Representatives","Florida State UniversityCollege of William & Mary","2017",1982
"Florida 2","Dunn, NealNeal Dunn",NA,"Republican","Surgeon","Washington & Lee UniversityGeorge Washington University School of Medicine & Health Sciences","2017",1953
"Florida 3","Yoho, TedTed Yoho",NA,"Republican","Veterinarian","University of Florida","2013",1955
"Florida 4","Rutherford, JohnJohn Rutherford",NA,"Republican","Sheriff of Jacksonville","Florida State UniversityFBI Academy","2017",1952
"Florida 5","Lawson, AlAl Lawson",NA,"Democratic","Florida Senate","Florida A&M University","2017",1948
"Florida 6","DeSantis, RonRon DeSantis",NA,"Republican","Prosecutor U.S. Attorney's Office, U.S. Navy","Yale UniversityHarvard Law School","2013",1978
"Florida 7","Murphy, StephanieStephanie Murphy",NA,"Democratic","Advisor, educator","College of William & MaryGeorgetown University","2017",1978
"Florida 8","Posey, BillBill Posey",NA,"Republican","Florida Senate, Florida House of Representatives, Rockledge, Florida City Council","Nova Southeastern University","2009",1947
"Florida 9","Soto, DarrenDarren Soto",NA,"Democratic","Florida Senate, Florida House of Representatives","Rutgers UniversityGeorge Washington University","2017",1978
"Florida 10","Demings, ValVal Demings",NA,"Democratic","Chief of the Orlando Police Department","Florida State University","2017",1957
"Florida 11","Webster, DanielDaniel Webster",NA,"Republican","Florida SenateSpeaker of Florida House of Representatives","Georgia Institute of Technology","2011",1949
"Florida 12","Bilirakis, GusGus Bilirakis",NA,"Republican","Florida House of Representatives","University of FloridaStetson University College of Law","2007",1963
"Florida 13","Crist, CharlieCharlie Crist",NA,"Democratic","Governor of Florida, Attorney General of Florida, Education Commissioner of Florida, Florida Senate","Wake Forest UniversityFlorida State UniversitySamford University","2017",1956
"Florida 14","Castor, KathyKathy Castor",NA,"Democratic","Assistant General Counsel to the Florida Department of Community Affairs, President of the Florida Association of Women Lawyers, Hillsborough County, Florida Board of Commissioners","Emory University","2007",1966
"Florida 15","Ross, DennisDennis Ross",NA,"Republican","Florida House of Representatives","Auburn UniversityCumberland School of Law","2011",1959
"Florida 16","Buchanan, VernVern Buchanan",NA,"Republican","Auto Dealer","Cleary University","2007",1951
"Florida 17","Rooney, TomTom Rooney",NA,"Republican","Criminal Prosecutor Florida Department of Justice, Attorney","Washington & Jefferson CollegeUniversity of Florida","2009",1970
"Florida 18","Mast, BrianBrian Mast",NA,"Republican","U.S. Army Soldier","None","2017",1980
"Florida 19","Rooney, FrancisFrancis Rooney",NA,"Republican","United States Ambassador to the Holy See","Georgetown University","2017",1953
"Florida 20","Hastings, AlceeAlcee Hastings",NA,"Democratic","Judge of the United States District Court for the Southern District of Florida","Fisk University","1993",1936
"Florida 21","Deutch, TedTed Deutch",NA,"Democratic","Florida Senate","University of MichiganUniversity of Michigan Law School","2010*",1966
"Florida 22","Frankel, LoisLois Frankel",NA,"Democratic","Mayor of West Palm Beach, Florida House of Representatives","Boston UniversityGeorgetown University Law Center","2013",1948
"Florida 23","Wasserman Schultz, DebbieDebbie Wasserman Schultz",NA,"Democratic","Florida Senate, Florida House of Representatives","University of Florida","2005",1966
"Florida 24","Wilson, FredericaFrederica Wilson",NA,"Democratic","Florida Senate, Florida House of Representatives, Miami-Dade County Public Schools Board","Fisk UniversityUniversity of Miami","2011",1942
"Florida 25","Díaz-Balart, MarioMario Díaz-Balart",NA,"Republican","Florida Senate, Florida House of Representatives","University of South Florida","2003",1961
"Florida 26","Curbelo, CarlosCarlos Curbelo",NA,"Republican","Public administrator, Miami-Dade County Public Schools Board","University of Miami","2015",1980
"Florida 27","Ros-Lehtinen, IleanaIleana Ros-Lehtinen",NA,"Republican","Florida Senate, Florida House of Representatives","Florida International UniversityUniversity of Miami","1989*",1952
"Georgia 1","Carter, BuddyBuddy Carter",NA,"Republican","Georgia State Senate, Georgia House of Representatives, Mayor of Pooler","Young Harris CollegeUniversity of Georgia","2015",1957
"Georgia 2","Bishop, SanfordSanford Bishop",NA,"Democratic","Georgia State Senate, Georgia House of Representatives","Morehouse College","1993",1947
"Georgia 3","Ferguson, DrewDrew Ferguson",NA,"Republican","Mayor of West Point, Georgia","University of GeorgiaMedical College of Georgia","2017",1966
"Georgia 4","Johnson, HankHank Johnson",NA,"Democratic","DeKalb County, Georgia Commissioner, Associate Magistrate Judge","Clark Atlanta University","2007",1954
"Georgia 5","Lewis, JohnJohn Lewis",NA,"Democratic","Atlanta City Council, Chairman of the Student Nonviolent Coordinating Committee","American Baptist Theological Seminary","1987",1940
"Georgia 6","Handel, KarenKaren Handel",NA,"Republican","businessman, non profit executive, Secretary of State of Georgia","","2017*",1962
"Georgia 7","Woodall, RobRob Woodall",NA,"Republican","Political aide, Attorney","Furman UniversityUniversity of Georgia","2011",1970
"Georgia 8","Scott, AustinAustin Scott",NA,"Republican","Georgia House of Representatives","University of Georgia","2011",1969
"Georgia 9","Collins, DougDoug Collins",NA,"Republican","Georgia House of Representatives","North Georgia CollegeNew Orleans Baptist Theological Seminary","2013",1966
"Georgia 10","Hice, JodyJody Hice",NA,"Republican","Radio show host, Southern Baptist pastor","Asbury UniversitySouthwestern Baptist Theological SeminaryLuther Rice Seminary","2015",1960
"Georgia 11","Loudermilk, BarryBarry Loudermilk",NA,"Republican","Georgia State Senate, Georgia House of Representatives","U.S. Air Force Community CollegeWayland Baptist University","2015",1963
"Georgia 12","Allen, Rick W.Rick W. Allen",NA,"Republican","Businessman","Auburn University","2015",1951
"Georgia 13","Scott, DavidDavid Scott",NA,"Democratic","Georgia State Senate, Georgia House of Representatives","Florida A&M University","2003",1945
"Georgia 14","Graves, TomTom Graves",NA,"Republican","Georgia House of Representatives,","University of Georgia","2010*",1970
"Hawaii 1","Hanabusa, ColleenColleen Hanabusa",NA,"Democratic","Hawaii Senate","University of Hawaii at Manoa","2016*",1951
"Hawaii 2","Gabbard, TulsiTulsi Gabbard",NA,"Democratic","Honolulu City Council, Hawaii House of Representatives","Hawaii Pacific UniversityOfficer Candidate School","2013",1981
"Idaho 1","Labrador, RaúlRaúl Labrador",NA,"Republican","Idaho House of Representatives","Brigham Young UniversityUniversity of Washington","2011",1967
"Idaho 2","Simpson, MikeMike Simpson",NA,"Republican","Speaker of the Idaho House of Representatives, Blackfoot, Idaho City Council","Utah State University","1999",1950
"Illinois 1","Rush, BobbyBobby Rush",NA,"Democratic","Chicago City Council","Roosevelt UniversityUniversity of IllinoisMcCormick Theological Seminary","1993",1946
"Illinois 2","Kelly, RobinRobin Kelly",NA,"Democratic","Illinois House of Representatives, Chief of Staff to the Illinois Treasurer, Chief Administrative Officer to the Cook County President","Bradley UniversityNorthern Illinois University","2013*",1956
"Illinois 3","Lipinski, DanDan Lipinski",NA,"Democratic","Member of the University of Notre Dame and University of Tennessee Faculty","Northwestern UniversityStanford UniversityDuke University","2005",1966
"Illinois 4","Gutiérrez, LuisLuis Gutiérrez",NA,"Democratic","Chicago City Council","Northeastern Illinois University","1993",1953
"Illinois 5","Quigley, MikeMike Quigley",NA,"Democratic","Cook County Board of Commissioners","Roosevelt UniversityLoyola University Chicago School of LawUniversity of Chicago","2009*",1958
"Illinois 6","Roskam, PeterPeter Roskam",NA,"Republican","Illinois Senate, Illinois House of Representatives","University of IllinoisChicago–Kent College of Law","2007",1961
"Illinois 7","Davis, Danny K.Danny K. Davis",NA,"Democratic","Chicago City Council, Cook County Board of Commissioners","University of Arkansas at Pine BluffChicago State UniversityUnion Institute and University","1997",1941
"Illinois 8","Krishnamoorthi, RajaRaja Krishnamoorthi",NA,"Democratic","Public Servant, Lawyer","Princeton UniversityHarvard Law School","2017",1973
"Illinois 9","Schakowsky, JanJan Schakowsky",NA,"Democratic","Illinois House of Representatives","University of Illinois","1999",1944
"Illinois 10","Schneider, BradBrad Schneider",NA,"Democratic","U.S. House","Northwestern University","2017",1961
"Illinois 11","Foster, BillBill Foster",NA,"Democratic","U.S. House","University of Wisconsin–MadisonHarvard University","2013",1955
"Illinois 12","Bost, MikeMike Bost",NA,"Republican","Illinois House of Representatives","University of Illinois","2015",1960
"Illinois 13","Davis, RodneyRodney Davis",NA,"Republican","Congressional Staffer","Millikin University","2013",1970
"Illinois 14","Hultgren, RandyRandy Hultgren",NA,"Republican","Illinois Senate, Illinois House of Representatives, DuPage County, Illinois Board of Commissioners","Bethel UniversityChicago-Kent College of Law","2011",1966
"Illinois 15","Shimkus, JohnJohn Shimkus",NA,"Republican","Madison County, Illinois Treasurer","United States Military AcademySouthern Illinois University","1997",1958
"Illinois 16","Kinzinger, AdamAdam Kinzinger",NA,"Republican","McLean County, Illinois Board of Commissioners","Illinois State University","2011",1978
"Illinois 17","Bustos, CheriCheri Bustos",NA,"Democratic","East Moline City Council","University of MarylandUniversity of Illinois at Springfield","2013",1961
"Illinois 18","LaHood, DarinDarin LaHood",NA,"Republican","Illinois Senate, Prosecutor U.S. Attorney's Office, Deputy Prosecutor Tazewell County, Illinois","John Marshall Law SchoolLoras College","2015*",1968
"Indiana 1","Visclosky, PetePete Visclosky",NA,"Democratic","Attorney, Congressional aide","Indiana University NorthwestUniversity of Notre DameGeorgetown University","1985",1949
"Indiana 2","Walorski, JackieJackie Walorski",NA,"Republican","Indiana House of Representatives","Liberty Baptist CollegeTaylor University","2013",1963
"Indiana 3","Banks, JimJim Banks",NA,"Republican","Indiana Senate","Indiana University BloomingtonGrace College & Seminary","2017",1979
"Indiana 4","Rokita, ToddTodd Rokita",NA,"Republican","Indiana Secretary of State","Wabash CollegeIndiana University Robert H. McKinney School of Law","2011",1970
"Indiana 5","Brooks, SusanSusan Brooks",NA,"Republican","U.S. Attorney for Southern Indiana, Deputy Mayor of Indianapolis","Miami UniversityIndiana University Robert H. McKinney School of Law","2013",1960
"Indiana 6","Messer, LukeLuke Messer",NA,"Republican","Indiana House of Representatives","Wabash CollegeVanderbilt University Law School","2013",1969
"Indiana 7","Carson, AndréAndré Carson",NA,"Democratic","Indianapolis City-County Council","Concordia University WisconsinIndiana Wesleyan University","2008*",1974
"Indiana 8","Bucshon, LarryLarry Bucshon",NA,"Republican","Heart Surgeon","University of Illinois at Urbana-ChampaignUniversity of Illinois Medical School","2011",1962
"Indiana 9","Hollingsworth, TreyTrey Hollingsworth",NA,"Republican","CEO of Hollingsworth Capital Partners","Georgetown UniversityUniversity of Pennsylvania","2017",1983
